{
  "$schema": "./phase-0-evidence-schema.json",
  "manifest_version": "2.0",
  "baseline": {
    "repository_head": "34edd2b3c8164b59ed9b2b2964c0d79f7c2d399a",
    "plan_path": "docs/dev/Phased_Feature_Implementation_Plan.md",
    "plan_git_blob": "a6a8754170c5ff1a0ba853f8b3d91f43a68aa2a3",
    "plan_sha256": "421120edda333378eed98f39e9e0a8c0870f50308cd5b96828175be33bbb328f",
    "legacy_unattested_plan_sha256": "7fba3b8aa82ad94652c353ca997051067caa5fce650f39f389e9e9e705a5b5f6",
    "register_path": "docs/dev/Feature_Requirement_Traceability_Register.md",
    "register_sha256": "4e3f60f0f5166bf372e51a0c991f3d312a998049b5a44e1db7d9d5e876575b58",
    "register_git_blob": "9344ac5ab62cf948ad253fc9d93aafb3e1fcf430",
    "original_spec_blob": "7b592a2c25276ceae7cf7011f0a4f98eabe9c7fd",
    "pinned_spec_blob": "d69bef59cb981350cd6f2ebdccc31b231a4e0950",
    "normalized_register": "docs/dev/evidence/source/traceability-register.json",
    "normalized_dependency_graph": "docs/dev/evidence/source/dependency-graph.json"
  },
  "feature_ids": [
    "FEAT-UI-COMPOSE_WORKSPACE",
    "FEAT-UI-TYPED_BACKEND",
    "FEAT-WS-MANAGE_WORKSPACES",
    "FEAT-WS-MANAGE_ACCOUNTS",
    "FEAT-PLUG-DECLARE_MANIFESTS",
    "FEAT-UI-VIEW_COLLECTIONS",
    "FEAT-UI-REVIEW_DRAFTS",
    "FEAT-IFACE-SERVE_API_EVENTS",
    "FEAT-WS-EXECUTE_PERSISTENCE",
    "FEAT-WS-SECURE_LOCAL_ACCESS",
    "FEAT-WS-ADMINISTER_SETTINGS",
    "FEAT-PLUG-REGISTER_CONTRIBUTIONS",
    "FEAT-IFACE-OPERATE_IDENTITY",
    "FEAT-ORCH-RESERVE_RESOURCES",
    "FEAT-AGT-ENFORCE_MANDATE",
    "FEAT-UI-SESSION_ACCESS",
    "FEAT-WS-MANAGE_ARTIFACTS",
    "FEAT-ORCH-MANAGE_JOBS",
    "FEAT-AGT-OPERATE_RUNS",
    "FEAT-AGT-REGISTER_ROLES",
    "FEAT-WS-BUILD_DIAGNOSTICS",
    "FEAT-ORCH-EXECUTE_LOCAL_WORK",
    "FEAT-AGT-GOVERN_TOOL_CALLS",
    "FEAT-AGT-INVOKE_MODELS",
    "FEAT-IFACE-OPERATE_SETTINGS",
    "FEAT-IFACE-OPERATE_JOBS",
    "FEAT-UI-WORKSPACE_NAVIGATION",
    "FEAT-UI-SYSTEM_SETTINGS",
    "FEAT-UI-RUN_MONITOR",
    "FEAT-UI-DEBUG_CONSOLE",
    "FEAT-CAT-CATALOG_INSTRUMENTS",
    "FEAT-CAT-DEFINE_SESSIONS",
    "FEAT-BRK-METATRADER",
    "FEAT-BRK-CTRADER",
    "FEAT-BRK-BINANCE",
    "FEAT-BRK-DUKASCOPY",
    "FEAT-BRK-YAHOO",
    "FEAT-BRK-RESOLVE",
    "FEAT-DATA-MARKET_DATA_STORE",
    "FEAT-CAT-MAP_PROVIDERS",
    "FEAT-CAT-DEFINE_TRADING_RULES",
    "FEAT-CAT-CONVERT_CURRENCIES",
    "FEAT-DATA-RESOLVE_QUALITY",
    "FEAT-DATA-AGGREGATE_BARS",
    "FEAT-DATA-MANAGE_RETENTION",
    "FEAT-DATA-NORMALIZE_TICKS",
    "FEAT-DATA-GENERATE_SCENARIOS",
    "FEAT-DATA-TRACK_MARKET_NEWS",
    "FEAT-DATA-INGEST_HISTORY",
    "FEAT-DATA-BIND_RUN_DATA",
    "FEAT-DATA-STREAM_MARKET_EVENTS",
    "FEAT-CAT-MANAGE_UNIVERSES",
    "FEAT-DATA-ALIGN_SERIES",
    "FEAT-DATA-SYNC_CONNECTORS",
    "FEAT-DATA-PREPARE_PROFILES",
    "FEAT-DATA-IMPORT_QUANTDATA",
    "FEAT-CAT-EXCHANGE_CATALOGUE",
    "FEAT-DATA-IMPORT_INDICATORS",
    "FEAT-DATA-BROWSE_REFERENCE",
    "FEAT-IFACE-OBSERVE_MARKET_REFERENCE",
    "FEAT-UI-DATA_MANAGER",
    "FEAT-UI-MARKET_CHARTS",
    "FEAT-IND-CALCULATE_TREND",
    "FEAT-IND-CALCULATE_MOMENTUM",
    "FEAT-IND-CALCULATE_VOLATILITY",
    "FEAT-IND-CALCULATE_VOLUME_FLOW",
    "FEAT-IND-DETECT_CANDLE_PATTERNS",
    "FEAT-IND-TRANSFORM_SERIES",
    "FEAT-STRAT-DEFINE_AST",
    "FEAT-STRAT-CATALOG_BLOCKS",
    "FEAT-STRAT-CONFIGURE_CHARTS",
    "FEAT-STRAT-MODEL_ATM_EXITS",
    "FEAT-STRAT-EDIT_TEMPLATES",
    "FEAT-STRAT-DEFINE_INDICATORS",
    "FEAT-STRAT-COMPILE_STRATEGIES",
    "FEAT-STRAT-VERSION_STRATEGIES",
    "FEAT-STRAT-GENERATE_CODE",
    "FEAT-STRAT-EXCHANGE_STRATEGIES",
    "FEAT-IFACE-OPERATE_STRATEGIES",
    "FEAT-UI-STRATEGY_STUDIO",
    "FEAT-UI-PERFORMANCE_LAB",
    "FEAT-RSK-SIZE_POSITIONS",
    "FEAT-RSK-ASSESS_RESEARCH_RISK",
    "FEAT-TRD-MANAGE_EXECUTION_SESSIONS",
    "FEAT-TRD-MODEL_EXECUTION_POLICIES",
    "FEAT-SIM-MODEL_TICKS",
    "FEAT-ANA-COMPUTE_METRICS",
    "FEAT-SIM-CONFIGURE_ENGINE",
    "FEAT-SIM-EXECUTE_TICKS",
    "FEAT-SIM-COMMIT_RESULTS",
    "FEAT-IFACE-OPERATE_SIMULATIONS",
    "FEAT-SIM-CACHE_EVALUATIONS",
    "FEAT-ANA-QUERY_RESULTS",
    "FEAT-ANA-DATABANK_MEMBERSHIP",
    "FEAT-ANA-ANALYZE_TRADES",
    "FEAT-ANA-PROJECT_SERIES",
    "FEAT-ANA-COMPARE_RESULTS",
    "FEAT-ANA-EXCHANGE_RESULTS",
    "FEAT-IFACE-OPERATE_RESULTS",
    "FEAT-UI-RUN_BACKTEST",
    "FEAT-UI-RESEARCH_WORKBENCH",
    "FEAT-UI-DATABANK_GRID",
    "FEAT-UI-RESULT_OVERVIEW",
    "FEAT-UI-TRADE_LIST",
    "FEAT-UI-EQUITY_CHART",
    "FEAT-UI-TRADE_ANALYSIS",
    "FEAT-UI-TRADES_ON_CHART",
    "FEAT-UI-SESSION_CONTEXT",
    "FEAT-WS-MANAGE_CONVERSATIONS",
    "FEAT-AGT-ASSEMBLE_CONTEXT",
    "FEAT-AGT-RUN_WORKFLOWS",
    "FEAT-AGT-EVALUATE_PROFILES",
    "FEAT-AGT-MANAGE_CLAIMS",
    "FEAT-AGT-SYNTHESIZE_RESEARCH",
    "FEAT-AGT-ASSIST_OPERATOR",
    "FEAT-IFACE-AGENTIC_GATEWAY",
    "FEAT-UI-CHAT_BOT",
    "FEAT-UI-AGENTIC_RUN_INSPECTOR",
    "FEAT-STRAT-ACCEPT_PROPOSALS",
    "FEAT-RES-GOVERN_CAMPAIGNS",
    "FEAT-RES-DEFINE_PROTOCOLS",
    "FEAT-AGT-COMPOSE_STRATEGY_PROPOSALS",
    "FEAT-RES-GOVERN_HOLDOUTS",
    "FEAT-RES-RUN_RESEARCH",
    "FEAT-IFACE-OPERATE_RESEARCH",
    "FEAT-AGT-GOVERN_RESEARCH_SEARCH",
    "FEAT-AGT-DESIGN_RESEARCH",
    "FEAT-AGT-COMPOSE_STRATEGY_SPECS",
    "FEAT-UI-EXECUTE_ORDERS",
    "FEAT-SIM-PERTURB_INPUTS",
    "FEAT-ANA-ANALYZE_DISTRIBUTIONS",
    "FEAT-AGT-DELIBERATE_RESEARCH",
    "FEAT-RES-TEST_ROBUSTNESS",
    "FEAT-UI-ROBUSTNESS_RESULTS",
    "FEAT-RES-QUALIFY_RESEARCH",
    "FEAT-UI-STRATEGY_RETESTER",
    "FEAT-STRAT-DEFINE_SEARCH_SPACES",
    "FEAT-RES-RANK_CANDIDATES",
    "FEAT-RES-GENERATE_STRATEGIES",
    "FEAT-RES-EVOLVE_STRATEGIES",
    "FEAT-UI-STRATEGY_BUILDER",
    "FEAT-OPT-SEARCH_PARAMETERS",
    "FEAT-OPT-VALIDATE_WALK_FORWARD",
    "FEAT-OPT-PERMUTE_PARAMETERS",
    "FEAT-IFACE-OPERATE_OPTIMIZATION",
    "FEAT-UI-PARAMETER_OPTIMIZER",
    "FEAT-UI-OPTIMIZATION_RESULTS",
    "FEAT-POR-COMPOSE_PORTFOLIOS",
    "FEAT-POR-ANALYZE_CORRELATION",
    "FEAT-ANA-FILTER_CORRELATION",
    "FEAT-POR-OPTIMIZE_WEIGHTS",
    "FEAT-POR-SIMULATE_PORTFOLIOS",
    "FEAT-POR-ANALYZE_PORTFOLIO_RISK",
    "FEAT-POR-MERGE_PORTFOLIOS",
    "FEAT-POR-SEARCH_PORTFOLIOS",
    "FEAT-AGT-ADVISE_PORTFOLIO",
    "FEAT-IFACE-OPERATE_PORTFOLIOS",
    "FEAT-UI-PORTFOLIO_COMPOSER",
    "FEAT-UI-PORTFOLIO_BUILDER",
    "FEAT-TRD-OBSERVE_OUTCOMES",
    "FEAT-ORCH-DEFINE_PROJECTS",
    "FEAT-ORCH-EXECUTE_UTILITIES",
    "FEAT-ORCH-DELIVER_NOTIFICATIONS",
    "FEAT-AGT-MANAGE_MEMORY",
    "FEAT-ORCH-RUN_PROJECTS",
    "FEAT-AGT-CALIBRATE_OUTCOMES",
    "FEAT-IFACE-EDIT_PROJECTS",
    "FEAT-UI-PROJECT_EDITOR",
    "FEAT-PLUG-SANDBOX_PERMISSIONS",
    "FEAT-PLUG-AUTHOR_PACKAGES",
    "FEAT-PLUG-ISOLATE_ANALYSIS",
    "FEAT-PLUG-RENDER_RESULT_PANELS",
    "FEAT-STRAT-GENERATE_MQL5",
    "FEAT-STRAT-GENERATE_PYTHON",
    "FEAT-ANA-PROVIDE_CUSTOM_ANALYSIS",
    "FEAT-PLUG-MANAGE_LIFECYCLE",
    "FEAT-PLUG-MAINTAIN_COMPATIBILITY",
    "FEAT-AGT-AUTHOR_SANDBOX_ARTIFACTS",
    "FEAT-IFACE-ADMINISTER_CAPABILITIES",
    "FEAT-UI-CODE_EDITOR",
    "FEAT-UI-INDICATOR_TESTER",
    "FEAT-IND-CALCULATE_MARKET_PROFILES",
    "FEAT-STRAT-DEFINE_ARCHITECTURES",
    "FEAT-SIM-SIMULATE_STOCKPICKERS",
    "FEAT-UI-ADVANCED_ANALYSIS",
    "FEAT-RES-PREPARE_NEURAL_DATASETS",
    "FEAT-RES-LABEL_NEURAL_DATA",
    "FEAT-RES-INFER_MODELS",
    "FEAT-RES-TRAIN_MODELS",
    "FEAT-RES-VALIDATE_MODELS",
    "FEAT-RES-EXPLAIN_MODELS",
    "FEAT-UI-NEURAL_RESEARCH",
    "FEAT-ORCH-MANAGE_REMOTE_WORKERS",
    "FEAT-IFACE-AUTOMATE_COMMANDS",
    "FEAT-WS-DISTRIBUTE_APPLICATION",
    "FEAT-BRK-DARWINEX",
    "FEAT-BRK-COINBASE",
    "FEAT-BRK-BITFINEX",
    "FEAT-BRK-POLONIEX",
    "FEAT-BRK-CONNECT_MARKET_FEEDS",
    "FEAT-STRAT-GENERATE_TARGETS",
    "FEAT-ANA-IMPORT_EXTERNAL_LEDGERS",
    "FEAT-STRAT-IMPORT_SQX",
    "FEAT-STRAT-PACKAGE_STRATEGIES",
    "FEAT-UI-STRATEGY_PACKAGER"
  ],
  "inventory": {
    "total_features": 205,
    "total_domains": 18,
    "total_normalized_frs": 575,
    "total_local_nfrs": 276,
    "total_shared_nfrs": 66,
    "total_catalogue_entries": 646,
    "total_original_identified_requirements": 389,
    "total_workflows": 20,
    "total_required_edges": 477,
    "total_operation_gated_edges": 233,
    "registered_entry_points": 41
  },
  "domain_distribution": {
    "Agentic": 20,
    "Analytics": 11,
    "Brokers": 11,
    "Catalogue": 7,
    "Data": 16,
    "Indicators": 7,
    "Interfaces": 15,
    "Optimization": 3,
    "Orchestration": 8,
    "Plugins": 8,
    "Portfolio": 7,
    "Research": 15,
    "Risk": 2,
    "Simulator": 7,
    "Strategy": 18,
    "Trading": 3,
    "UI": 38,
    "Workspace": 9
  },
  "status_distribution": {
    "COMPLETE": 2,
    "EXISTING_UNVERIFIED": 37,
    "NOT_STARTED_IN_TARGET": 151,
    "PARTIAL": 15
  },
  "drift_disposition": {
    "status": "RECONCILED_NO_SCOPE_DRIFT",
    "added_features": [],
    "removed_features": [],
    "scope_impact": "NONE",
    "historical_blob_diff": "6 insertions and 6 deletions; documentary code-example formatting only"
  }
}
